{
  "id": "porridge",
  "name": {
    "en": "Porridge",
    "de": "Haferbrei"
  },
  "hero": {
    "en": "the warm bowl that starts the day.",
    "de": "die warme Schale, mit der der Tag anfängt."
  },
  "cap": {
    "en": "photo: a steaming bowl, banana slices fanned out",
    "de": "Foto: eine dampfende Schale, Bananenscheiben aufgefächert"
  },
  "stripe": "#d9b26f",
  "recipes": [],
  "partition_id": "core",
  "secondary_partitions": [],
  "cuisine_tags": [
    "american"
  ],
  "frequency_tier": "core"
}
